{"bindings":{"registration":{"artifact_sha256":"6ea23cd3e95c6ee72ef58d1af28052b530004109fc55c1efccbb0e10d6762de5","content_sha256":"3986e69e3359e9a2e3e782babb6f21ecef7a9075049088410abdeef816a55ad4","request_artifact_sha256":"2944123650b5b04cbf9230216eabf8c2d00988ab4da453e074ef0b0b79879e04","request_sha256":"1faee313ae3304c01f29ee88441485ef9b2083e22a00fae851c8344ddaee22e8"},"selections":[{"artifact_sha256":"bc49fd635a322be287d14cc404d9dd96c473ba288a700537d4306c739ee93338","content_sha256":"b2998988cb913ff7f4f955744cdc185a80a24906bb84dc8c635e9da07cf16576","kind":"trade","request_sha256":"b7ee79cb7007eb65bc738573fdb06977fc0dcc58735707d6f4ed78a64be9950e","segment":1},{"artifact_sha256":"1d951ef30686f34e9c988a49a27fdeb9528135c1a39c3bcdf233232c31758a54","content_sha256":"f68d6657a480100ae3666601253237495866dd1af01aca7d8b72f1cbaf7d9e43","kind":"trade","request_sha256":"268ddb612de11c7ffd10a27206529b08e093837a1de5ffb964c08d5d0a248b42","segment":2},{"artifact_sha256":"4b66ee3c2b6f8f4369c3dfc3d66fb2faa5dd2d8652d36e17ee80ba4a8783d463","content_sha256":"5f79ab06140b30c2ec890c77e2cea7181067c9427d40922eebabe6a49eff4e07","kind":"mark","request_sha256":"07a06945c8a615937f1c1ba8eb9d67ebd7e713bd34006015ffd908631471b015","segment":1},{"artifact_sha256":"36a1d2e93e3de92e14acdf5d91a413c3dab217dbecae449fcc905b9c07f21172","content_sha256":"761e47e3db0a28f45cf2cc94c3d8ee16cf54c61f2d376821c0b7360718228e1e","kind":"mark","request_sha256":"2ac6ea0fb543434c963aaafbc26bad9f2ed2885c7e7023371fb5bc46f2037afa","segment":2}]},"catalog":{"content_sha256":"91bc7695737585b6bb1f36af159d03d6a4aeb1e8debc506bffcf023e4ce0c20e","revision":5,"schema_version":1},"content_sha256":"5836c774e353f6deaae7e5642c8390a45dea7a66f396944ae45f46a2def858f8","evidence_schema":"grid.phase2-full-history-catalog/v1","generated_at_utc":"2026-08-14T12:41:09.327626Z","inventory":{"by_kind":[{"dataset_count":489,"empty_dataset_count":134,"kind":"trade","object_count":489,"row_count":15413811,"size_bytes":329345744},{"dataset_count":489,"empty_dataset_count":134,"kind":"mark","object_count":489,"row_count":15418523,"size_bytes":200449015}],"dataset_count":978,"empty_dataset_count":268,"object_count":978,"required_partition_count":978,"row_count":30832334,"size_bytes":529794759},"limitations":["Catalog registration and deterministic selection do not prove gap-free historical coverage.","Topology segments preserve campaign partition presence but do not infer lifecycle metadata.","Schema-only selected objects preserve source lineage and do not accept missing history.","The DuckDB catalog remains a rebuildable index; canonical receipts remain authoritative.","This evidence does not close Gate 2 or authorize research promotion or live execution."],"process":{"catalog_registration_receipt_verified":true,"evidence_builder_software_identity":"git:bd79038ff7f24013c3b300b662933b82f16db7a1","registration_request_receipt_verified":true,"selection_receipts_verified":true,"selection_union_matches_registration":true},"status":"verified-full-history-catalog-selection","storage_policy":{"evidence_contains_account_data":false,"evidence_contains_dataset_identities":false,"evidence_contains_instrument_identities":false,"evidence_contains_market_values":false,"evidence_contains_runtime_paths":false,"runtime_catalog_or_market_artifacts_committed_to_git":false},"topology":[{"bucket_count":4,"dataset_count":208,"empty_dataset_count":208,"instrument_count":4,"month_count":26,"object_count":208,"row_count":0,"segment":1,"size_bytes":794872},{"bucket_count":5,"dataset_count":770,"empty_dataset_count":60,"instrument_count":5,"month_count":77,"object_count":770,"row_count":30832334,"segment":2,"size_bytes":528999887}]}
